{
  "terms": "https://example.com/terms/v3.json",
  "termsFormat": "json",
  "atrHash": "0x7f83b1657ff1fc53b92dc18148a1d65dfc2d4b1fa3d677284addd200126d9069",
  "acceptanceRequired": true,
  "disputeResolution": {
    "method": "Dispute Resolution Service Rules",
    "jurisdiction": "New York, USA",
    "contact": "disputes@example.com",
    "clauseId": "sha256:0xc2eb26d28ff4e229ff35917bd53339d82c1b30ec69435572a8872a4d7609c1dd",
    "source": "https://adr.example.org/clauses/dispute-resolution-service-rules",
    "catalog": "https://adr.example.org/.well-known/dispute-services.json"
  },
  "returns": "https://example.com/api/returns",
  "contact": {
    "legal": "legal@example.com",
    "technical": "api-support@example.com"
  },
  "api": "https://api.example.com/legal-context/v1"
}
